Book,Category,Section #,Section Name,Section Title,Subsection Type,Subsection Title,Content Type,Content,Content_Num,Author,Image,Source
Hacktivism,Techonology,,,,,,Intro Quote,"""Designing the employee's experience is more than applying flexible working hours and provide cool office spaces.""",1,Jacob Morgan,,
Hacktivism,Techonology,1,Facts and figures,Hacktivism,,,Section Description,"In the recent past, people used to adapt office space to work at their best; now they reshape their time to work in a way that suits them.",2,,,
Hacktivism,Techonology,1,Facts and figures,Hacktivism,,,Section Intro,"Hacking is the practice of modifying a process to accomplish a goal beyond the creator’s original objective. firstly used to describe often illegal activities, now it is widely applied to all individuals who possess exceptional skills and understanding of a system to adjust it according to their needs and desires.",3,,,
Hacktivism,Techonology,1,Facts and figures,Hacktivism,,,Body Copy,"Workplaces are built on human capital. They represent the place in which an organization expresses its common interests, purposes and visions. Where solidarity, reciprocity and resource sharing are embodied for the benefit of everybody.

According to Robert Putnam1, two different kinds of social capital exist. The first is the based on the relationships between homogenous groups, such as members of the same family or tribes and it is known as “bonding social capital”. The second is based on the positive interactions between hetereogeneous groups of people, such as ethnic groups or generations and it is known as “bridging social capital”.
In Putnam’s vision, the traditional organization could always rely on its bonding social capital. It was the glue that held the company together, fostering a sense of belonging and establishing shared values. But the forces of globalisation, demographic upheavals and the digital revolution has limited its influence. An increasingly diverse and disparate workforce has shifted the emphasis towards a greater balance between boding and bridging capital. So, a sense of belonging to a team becomes more important to flexible workers and freelancers while the sense of belonging to the organization depends on conecting teams harmoniously.

Research and experience show us that firms are already team based. They form naturally as teams focusing on sales, manufacturing, retail, product development, service and geographically independent divisions. The challenge is how to coordinate and align these teams, encouraging them to share ideas and information, work together and how we adapt to a new structure that is less focused on upward mobility and more on the development of leadership based on positional power2.

Josh Bersin, founder of Bersin by Deloitte, has underlined the importance of developing the ways in which teams work together and how to create well-balanced human capital as the primary goal of organizational design. This is mainly reflected in the capability of an organization to attract and retain the best talent, to allow them to work in the best possible way and to support them with the most engaging work settings, in terms of space, tools and resources.

“The new organization of today requires us to rethink leadership strategy, focus on culture and engagement, deliver on-demand organizational learning, and provide information centers, analytics, and digital HR tools to help people operate, share information, and work together well”3, he said.

An important aspect of the evolution in the way teams work together, is related to the way workers are included in decision making. The important thing is to avoid top-down impositions and offer the freedom to organise work to better match their work-life balance. Companies which do so have created a better working culture and are more able to adapt to new market conditions4. The interest in flatter organizations, which once was restricted to the tech industries, is rapidly spreading to all other sectors. Attracting new talent is still the strongest motivation for companies to invest in dynamic workplaces. Individuals have the choice to decide where, how and for how long they work. The basis on which they make such choices are diverse and no longer limited to attaining the best salary or career path.choice to decide where, how and how long they work and the drivers upon which they choose are very diverse and not only limited to the best salary or carrier path.

Back in 2006 before the last recession, “The Future of Work” research project from The Workplace Intelligence Unit found that there are at least 10 psychological drivers of workforce productivity which are typically more effective than financial rewards. These drivers - meaning, values, optimism, collaboration, confidence, individualism, autonomy, originality, goals and recognition (see table opposite) - represent the various reasons why employees feel satisfied and engaged in a particular company.

The last ten years have taught us that these factors are not permanent. They change over time as an employee’s needs, expectations and desires change. They also change in line with demographic and cultural changes in the workforce.

This is just as true for freelance and flexible workers as it is for permanent staff. Research shows that the vast majority of organizations (83 percent) consider their part time and contracted staff to be just as productive as full time employees5.

Among the drivers identified, those aspects which support a better work life balance and more flexibility have become increasingly important. This is less a gender based issue with both men and women asking for more time to spend with their families.

As life and work become increasingly integrated, the workers are looking to find new and better ways to balance their professional and personal commitments, asking for better working environments, for more freedom of choice and for the possibility of defining their own professional goals. These dynamics are changing the role of engagement. It is no longer a goal in its own right but a means to create a working experience which positively blurs the lines between private and public life as well as those between individuals, the company and the society.

They are seeking an experience in which their personal fulfillment goes hand in hand with the development of a workplace culture that is respectful of differences in characteristics like age, gender and culture, and that sees the employee not only as a person with skills and competences for the service of the company, but also as an agent of change, a person with healthy links to society and the world outside.

In this scenario, the idea of flexibility is not simply about the capability of the workplace to respond to change, but also the way the company embraces and manages the cultural and wider social changes it should adopt to meet the needs of individuals. “Hierarchical organizational models aren’t just being turned upside down — they’re being deconstructed from the inside out”6.

Technology has a great role to play in this change, but companies mainly need a cultural change: they need to include employees in the process of defining and deciding the company’s goals, allowing them to share their day-to-day experience with the management and participating in the creation of a flatter and flatter organization. Employees need to develop new skills, too.

More freedom at work brings responsibilities and opportunities such as the chance to manage time in a better way or collaborate with other team members to achieve shared goals. By developing such skills, employees gain the power to ""hack"" their working lives to following their personal preferences7, to pursue personal goals, propose new ideas or volunteer in social projects.

Increasingly these projects are welcomed by companies because they represent new forms of civic participation or activism that creates a sense of community within employees. In many cases the companies themselves propose cultural or social programs in which everybody is free to participate. “When individuals feel strongly about a company’s performance on social or environmental issue, one small voice can quickly become a swarm, difficult for even the most shielded executive to ignore”, says Jen Boynton8.

Connecting social issues with the business is a visible sign of a company which embraces democratization, takes care of its employees and bravely face new challenges. “Today our social investments focus on providing access to medicines and building health care capacity for those most in need"", said Caroline Roan, president of the Pfizer Foundation""9.

Making the world a better place” and “doing business” are no more seen as a different goals, as well as putting “the interests and priorities of the employees ahead of customers and shareholders” as millennials are largely entering in the workforce and the old fashion CSR mindset is transformed into “active business citizenship”10.

A paradigm shift based on the belief that higher profits and better products and services are generated by the links between business, community and actively engaged employees. A shift that transforms work from something in which employees do their best, to something in which they be their best.

NOTES
1 Putnam R., “Bowling Alone”, 2000.
2 Bersin J., “New Research Shows Why Focus On Teams (...)”, on Forbes. com, 2016
3 Idem
4 Hu E., “Inside the Bossless Office, where the team takes charge”, on www.npr.org, 2013
5 “2016 Workforce Productivity Report”, WorkMarket + KRC Research, 2016
6 McDowell T. et al., “Organizational Design: the raise of teams”, Deloitte, 2016
7 “Workers are increasingly looking to “design” the perfect balance between their personal and professional lives - and having a boss who will support them is a differentiator in their employment choice” in “Kelly Global Workforce Index”, 2015
8 Boynton J., “How the voice of the People is driving CSR”, in Harvard Business Review, 2013
9 “In the future companies will survive only if they help solve big social problems “ in www.forbes.com, 2014
10 “The future of business citizenship”, www.mslgroup.com",4,,,
Hacktivism,Techonology,1,Facts and figures,Hacktivism,,,Quote,"Cultural entropy is the degree of dysfunction, fear and negative energy in an organization or any human group structure that is generated by the self-serving, fear-based actions of a leader. ",5,"Sandja Brugman, The Passion Institute",,
Hacktivism,Techonology,1,Facts and figures,Hacktivism,,,Quote,"""The new mode of organization - a ""network of teams"" with a high degree of empowerment, strong communication and rapid information flow - is now sweeping businesses and governments around the world""",6,"""Global Human Capital Trends"" Deloitte, 2016",,
Hacktivism,Techonology,1,Facts and figures,Hacktivism,,,Quote,"Employee participation and involvement are different. the former is fostering a team approach, where projects are managed by sharing activities among a group of co-employees with the same goal. the latter usually implies a one-to-one approach between the employee and the management.",7,"Juliette Summers, Joseph Rowtree Foundation",,
Hacktivism,Techonology,1,Facts and figures,Hacktivism,,,Quote,Workers are increasingly looking to “design” the perfect balance between their personal and professional lives - and having a boss who will support them is a differentiator in their employment choice”.,8,"Kelly, ""Kelly Global Workforce Index"",2015",,
Hacktivism,Techonology,1,Facts and figures,Hacktivism,,,Photo,,9,,https://drive.google.com/file/d/1GqBuip7p2uO5wv0Qm3GpBPKkqqLXMzeb/view?usp=sharing,
Hacktivism,Techonology,1,Facts and figures,Hacktivism,,,Photo,,10,,https://drive.google.com/file/d/1Q_DSnJ6mQFhcGrSiZggxqWKpxAFLRlpa/view?usp=sharing,
Hacktivism,Techonology,1,Facts and figures,Hacktivism,,,Infographic,The perfect human capital in the office results from the balance between the bonding and the bridging abilities of people,11,,https://drive.google.com/file/d/1_kpmJ4o9-PTP6SaXrBtFb1BEIS1om5x1/view?usp=sharing,"Source: Putnam R., ""Bowling Alone"", 2000"
Hacktivism,Techonology,1,Facts and figures,Hacktivism,,,Infographic,"The 10 major trends in office management, ranked in order of importance",12,,https://drive.google.com/file/d/1LzGdNfxRMahgxwSILbEBp24Z11lancti/view?usp=sharing,"Data: Deloitte University Press, 2016"
Hacktivism,Techonology,1,Facts and figures,Hacktivism,,,Infographic,The 10 psychological drivers of workforce productivity which are more effective than financial reward,13,,https://drive.google.com/file/d/1bpXAE4v5evauuEDkqyRSzWOzHH7tDDWN/view?usp=sharing,"Data: ""The Future of Work"", The Workplace Intelligence Unit, 2006"
Hacktivism,Techonology,1,Facts and figures,Hacktivism,,,Infographic,"New organizations are characterized by a new management in which the traditional roles of the Facilities Manager and the Human Resources Manager are now condensed into a new role, whose priority is to support a network of teams and keep the culture of the company alive.",14,,https://drive.google.com/file/d/1D7S1Yxo8v-OQShKi9H_0SzRakd-719dx/view?usp=sharing,"Data: Deloitte University Press, 2016"
Hacktivism,Techonology,1,Facts and figures,Hacktivism,,,Infographic,"How values and needs change over different historical periods, systems of belief and generations: a comparison between the industrial, dream and creative societies.",15,,https://drive.google.com/file/d/1dC-5LK1PiPitRSwf0UPWl5tDq_HCThYl/view?usp=sharing,"Source: Et. a. ""The Creative Man"", The Copenhagen Istitute fo Future Studies, 2010."
Hacktivism,Techonology,1,Facts and figures,Hacktivism,,,Infographic,Seven Levels of organizational consciousness,16,,https://drive.google.com/file/d/1sfYwqIoJxLSPisF2teQOHva4bzE2GMur/view?usp=sharing,Source: Barret Values Centre
Hacktivism,Techonology,1,Facts and figures,Hacktivism,,,Infographic,,17,,https://drive.google.com/file/d/1V0pmIiw1gaekA4YTWkJ038w0r4Qzuowx/view?usp=sharing,
Hacktivism,Techonology,2,The expert‘s talk,Efficiency as result of transparency,,,Section Description,"An interview with Gianmaurizio Cazzarolli, of Tetra Pak Packaging Solutions in Modena Italy, the division of Tetra Pak Group that deals with the design and manufacture of aseptic packaging solutions for the transport of liquids.",18,,,
Hacktivism,Techonology,2,The expert‘s talk,Efficiency as result of transparency,,,Bio,"With a degree in Mechanical Engineering, Gianmaurizio Cazzarolli has worked for Tetra Pak since 1982. After a period in the R&D and customer services teams as a manager, today he serves as Director of the Facility and Real Estate Management in the research and production centre of the group in Modena. His team handles all the support operations for the 852 employees, more than 100 of whom come from some 32 countries, in a company that “cares about people, which represent our main investment and our competitive advantage”.",19,,,
Hacktivism,Techonology,2,The expert‘s talk,Efficiency as result of transparency,,,Interview,"Traditionally, efficiency and flexibility are seen as mutually exclusive when managing a workforce; when one increases the other decreases. This does not seem the case with organizations that care about the wellbeing of employees: what are your thoughts about that?

G.C. _ An open organization is one that cares about the welfare of people, offering the necessary flexibility to help them work better and it is often rewarded with a greater willingness from the employee to give more than expected. If a company is transparent and shares with its own employees information and goals, every person is aware of the work process, accepts responsibility and eventually is also available to help colleagues, knowing that next time they will help them back in return.

Therefore, our experience shows that efficiency and flexibility are not exclusive, at all. Empowering people and facilitating their interactions results in the optimization of the working process.

The secret lies in the common sharing of a corporate philosophy, a set of values that everyone must respect. Our mantra is to achieve the goals we have set in a project through the satisfaction and engagement of those who work in it.
Apparently, we are moving from a model of work in which the employees are free to customize their workplace to one in which they have the chance to choose times and places in which to work. Is that the case with Tetra Pak, too? How would this freedom of choice in the way to work impact on the role of management?

G.C. _ Tetra Pak is a family based company, founded in Sweden, a country with a very different working culture compared to those in the Mediterranean. In our offices flexibility has always been at the centre of the relationship between employee and company, at all possible levels.

Allowing flexibility means acknowledging that there are individual aspects - such as who is more efficient in the morning and who in the afternoon - organizational ones - such as those who work with clients in different time zone regions - and work-life balance ones that require a managerial skill to be learned. A skill that we try to teach through dialogue and the development of a particular mindset especially in managers, because it is obvious that if a manager offers greater recognition to someone for staying longer in the office than someone who is more efficient - as often happens in traditional businesses - this would go against the very idea of flexibility. It’s a continuous process that includes opportunities for discussion and support, exchange of experiences and respect for a transparent relationship between the various working levels of the company.

What is the importance of teams in this type of work process? What are the degrees of freedom?

G.C. _ Teams are key elements in the way we work. The employees take responsibility for the work of their own team. Successes and failures are shared and therefore it is in the team that we have to provide the flexibility to assure a good work-life balance.

Tetra Pak has taken the idea of “efficient flexibility” that is typically associated with the new economy and digital sector, and introduced it to a traditional manufacturing industry. What are the peculiarities and difficulties you've encountered in this regard?

G.C. _ First of all, we must specify that the concept of a team in Tetra Pak is not based on departments or functions, but on the set of people who, for various reasons and at different levels, are involved in a project. Therefore it involves people who are working on the project at different stages and in various ways, from the design and construction of machines to the phase of testing of packages or from R&D to commercial.

What are the values that Tetra Pak seeks to develop as the main link between the company and its employees through flexibility at work?

G.C. _ Definitely the main value of this relationship between employees and the company is transparency: there is no real sharing unless you have maximum information flow and knowledge about the challenges and the strategic goals of the company.

Based on that, we can then establish an open dialogue in which everybody can participate and set the modalities through which to achieve our stated goals.

The realisation stage of a project also has to be transparent. In our company the progress of all projects is visible to everybody. We have a so-called ""war room"", a sort of forum at the heart of the production plant, around which all operational areas converge: in this space, some panels report the production chains marked with green, yellow or red depending on whether they're complying with the schedule, they are addressing some problem or they are late.

Simply sharing this information establishes a dialogue between teams, promotes the exchange of experiences and activates forms of collaboration. But transparency is not just about information: all of our offices and facilities are designed for maximum visual transparency and flexibility.

The offices are conceived as smart boxes, made of glass panels, the layout of which can be easily modified in response to specific working requirements. Open space, meeting rooms, separate offices: when we contracted the architects who built our offices, we did not explain to them the way we work. The result was a modular building that allows changes very easily, over a weekend, without modifications to technical plants and still providing maximum transparency among the working spaces.

This is another way to allow people to take responsibility for their behaviours: everyone can see everyone, no hierarchy - of course ensuring confidentiality through the maximum insulation from noise.

Is the company engaged in social projects? How do these projects fit with the company's strategy and how are employees involved? Are they free to combine work and social commitments?

G.C. _ When you ask employees to stay at work overtime or respond to emails outside office hours it means you ask them to combine their professional and private lives. For us, this is acceptable only if allow it to work both ways. Between private interests and work commitments there are a lot of social initiatives that we sometimes promote as a company. We have teams that develop a sense of community amongst employees outside the office, such as those dedicated to artistic or sporting events or charity ones. Many of these projects are related to everyday life. So, we developed a series of public cycle lanes in partnership with the Municipality of Modena to encourage employees to bike to work. Similarly, we contributed to the building of a kindergarten which is open to the children of employees and local citizens. In this way we believe that the collaborative spirit that characterises our way of working can go beyond the gates of our company and become a model for other organizations.",20,,,
Hacktivism,Techonology,2,The expert‘s talk,Efficiency as result of transparency,,,Photo,,21,,,
Hacktivism,Techonology,2,The expert‘s talk,Efficiency as result of transparency,,,Photo,,22,,,
Hacktivism,Techonology,2,The expert‘s talk,Efficiency as result of transparency,,,Photo,,23,,,
Hacktivism,Techonology,3,Emerging Patterns,Trends,,,Section Description,"Eight case studies of the spaces, applications, initiatives, policies, products and services that reveal the importance of workplace strategy and how the world's greatest companies implement it.",24,,,
Hacktivism,Techonology,3,Emerging Patterns,Trends,Case Study,Go To Jupiter,Number,1,25,,,
Hacktivism,Techonology,3,Emerging Patterns,Trends,Case Study,Go To Jupiter,Photo,,26,,,
Hacktivism,Techonology,3,Emerging Patterns,Trends,Case Study,Go To Jupiter,Subtitle,Technology and gamification for continuous learning,27,,,
Hacktivism,Techonology,3,Emerging Patterns,Trends,Case Study,Go To Jupiter,Body Copy,"“Go to Jupiter” is an e-learning tool game developed by AstraZeneca, a biopharmaceutical company operating on a global scale, commit- ted to the research, development and commercialisation of ethical medicines.
“Go to Jupiter” is used to train 500 pharmaceutical representatives from the AstraZeneca Field Force on the characteristics and properties of new medicines. The AstraZeneca's agents play to earn points and improve their ranking against other players.
By answering various quizzes and playing different activities alone or in groups, the game has encouraged 97 percent of representatives to participate voluntarily online.
“Go to Jupiter” represents an example of how taking care of employees may also mean developing and introducing tools that share knowledge in the most enjoyable and collaborative way.",28,,,
Hacktivism,Techonology,3,Emerging Patterns,Trends,Case Study,Go To Jupiter,Link,www.alittleb.it/it/gamification-it/go-to-jupiter,29,,,
Hacktivism,Techonology,3,Emerging Patterns,Trends,Case Study,Southwest Airlines,Number,2,30,,,
Hacktivism,Techonology,3,Emerging Patterns,Trends,Case Study,Southwest Airlines,Photo,,31,,,
Hacktivism,Techonology,3,Emerging Patterns,Trends,Case Study,Southwest Airlines,Subtitle,Happy employees = Happy customers,32,,,
Hacktivism,Techonology,3,Emerging Patterns,Trends,Case Study,Southwest Airlines,Body Copy,"Southwest Airlines is often used as the perfect example of how to structure the relationship between a company and its employees. It is no coincidence that the firm enjoys a great reputation with customers and offeres exceptional service levels. That stems from the culture of the firm. It knows that if you treat your employees well, they will treat your customers well in turn.
The airline involves employees in many of its activities, including the design and development of the services it offers to customers. This depends on creating a creative and collborative working environment. Among its recent successes was a 19 month long process to redesign the uniforms of both cabin crew and ground staff.",33,,,
Hacktivism,Techonology,3,Emerging Patterns,Trends,Case Study,Southwest Airlines,Link,www.researchgate.net/publication/268718329_Southwest_ Airlines_Success_A_Case_Study_Analysis,34,,,
Don't Worry Be Healthy,Health & Wellbeing,1,Facts and figures,,,,Subtitle,"Wellbeing at the office is a good business strategy:
it increases the commitment and productivity of employees, it improves the company’s competitiveness and helps you win the war of talents",35,,,
Don't Worry Be Healthy,Health & Wellbeing,1,Facts and figures,,,,Infographic,31% of the world is inactive,36,,,
Don't Worry Be Healthy,Health & Wellbeing,1,Facts and figures,,,,Infographic,41% of the world is sedentary,37,,,
