Book,Category,Section #,Section Name,Section Title,Subsection Type,Subsection Title,Content Type,Content,Content_Num,Author,Image,Source
Generation Flex,Health & Wellbeing,,The expert‘s talk,HOW TO PROMOTE MULTIGENERATIONAL COLLABORATION,,,Interview,"Offices are becoming multigenerational spaces, where at least 4 generations work together side by side. What are the main aspects you have to take into consideration when creating spaces fostering the collaboration between different generations?
J.T._ There are two aspects that are most relevant:
1.        All generations can be integrated and co-designed.
The workplace should make people feel at home. They should identify themselves with their working environment and feel comfortable being there. For example, after a consultation with our facilities management team and the department involved, we redesigned and fitted out our own offices. We have introduced tables with castors to make them more adaptable, repainted walls to make them more attractive and specified lots of wooden elements and fitted curtains to the windows. This is certainly not something that works for every team, but in this case, it contributes enormously to our identity. These spaces are now very popular, as they are not only used by different generations, but also by the executive team.
2.        Create choices and spaces for different needs.
For customers who take part in our Work Smart coaching, it is essential to create spaces that facilitate communication and encourage people to share information spontaneously. This shortens lines of communication and significantly improves the ability of the organisation to innovate. Collaborative spaces are complemented by quieter areas, so-called silent zones, where people can retreat and focus.

You have created The Future Work Experience Team at Swisscom. Which is the purpose of the team and the role it has in your company?
J.T._ At Swisscom we have identified three action fields: Work Smart as the content of Swisscom; product and service innovation and Work Smart Coaching. In each of these fields we have a pilot and co-pilot. I am personally responsible for the field of Work Smart Coaching.
My role is to establish new ways of working with our customers and anchor them. The main factors in this regard are the workplace itself, technology, management and working culture. At Swisscom, the primary driver of cultural change in 2010 was the introduction of a new communication solution. This involved the removal of fixed line phones, amongst other things. Within Swisscom, we introduced a collaboration platform to help us share knowledge, create transparency and learn from each other. The primary aim of this project was the creation of an ‘Open Book Culture’. The first sign of the success of this was the fact that as well as our own company, we found that clients were also drawn to it. So, we started to offer Smart Work Coaching as a service. So far, our team has helped more than 70 companies in this way. A third outcome was that we began to facilitate the implementation of new technologies to foster communication and collaboration. Insights from the projects then feedback into the organisation and help us to develop new ideas.

Which are the main   challenges   and   opportunities of a multigenerational office? How do you handle the different needs and requirements of these generations in implementing new smart working concepts?
J.T._ At the moment, the situation is that older workers often want to engage with our team. This is partly based on a concern that younger people can do their work instead, so they will lose their jobs. However, we believe each person possesses unique skills in their field of expertise. So, for example, we find that older workers are markedly stronger when it comes to project management, whereas younger people are better with new technologies. We want
to harness these particular strengths, irrespective of a person’s age or background, and build on them. This allows us to match each employee as well as we possibly can with what they’re good at. Rather than focusing on their differences, we encourage employees to recognise and value the strengths of others. In this way, we create an environment based on trust, in which people are confident enough to break down barriers and develop their sense of curiosity.

One of the initiatives you guide is a so-called reverse mentoring. Please, tell us how it works and in which way you involve the different generations in these projects.
J.T._ Young employees are also involved in the coaching process, especially by helping older colleagues to adapt to new technologies. For example, specially produced videos communicate the way digital work can be carried out to other employees.
Cultural aspects are also communicated by the younger generation in a natural and playful way.
Part of the reason we employ specific people in the workplace is to help with the adoption of new technology. They wear red sweaters to make them instantly recognisable to colleagues. One of the interesting things we learned was how open older generations of workers are to work with their younger colleagues to learn about new digital devices.
We encourage younger people to present on new working methodologies and also give them the responsibility to lead projects. For example, the Head of Workspace & Collaboration spent several weeks reverse mentoring with one of our younger colleagues. One was responsible for explaining how Work Smart functions and the other was responsible for explaining the role of a management. They were able to learn from each other and to help each other. What are measures that a company should put in place to assure benefits to all generations? How do they contribute to a multi-generational wellbeing?
J.T._ Social Proof is the key factor. When Work Smart is implemented, it is extremely important that there is management buy-in, which means they promote it and live it too. The integration of different disciplines such as IT, HR, FM and communication plays an important role. Another aspect is empowerment and the transfer of responsibility to everybody including younger employees. For example, we recently witnessed a CEO encourage a young employee to join him in formulating a vision for the company. An openness to change and readiness to redefine the roles of young employees contribute to vertical integration.
This opens up new perspectives and creates an environment that does away with control and instead leads to trust and transparency. The right spaces offer the chance for young and old to come together in conversation and to exchange ideas.
These spaces also create new communities. At Swisscom, we also have a virtual employee who we call 'Smartina', who starts conversations about new working methods and is ready with advice and answers.




",112,,,
Generation Flex,Health & Wellbeing,,Emerging Patterns,Trends,Case Study,,Section Description,"Eight examples of spaces, applications, initiatives, policies, products and services that showcase the importance of getting workplace strategy right.",113,,,
Generation Flex,Health & Wellbeing,,Emerging Patterns,Trends,Case Study,THE INTERN,Subtitle,Multigenerational workforce and popular culture,114,,,
Generation Flex,Health & Wellbeing,,Emerging Patterns,Trends,Case Study,THE INTERN,Body Copy,"Today’s and tomorrow’s workforce is expected to work until age 65 or even more. Because of this, it is essential that educators, policymakers and business leaders have a deeper look at the dynamics of a multi- generational workforce, understand its nature and develop supportive management practices.
The Intern is “a comedy that uses humour to demonstrate the value of creating a multi-generational workforce in a world that often glorifies twenty-something billionaires and disregards issues of ageism in the workplace.”
Moreover, the movie highlights the beauty of a variety of work habits that co-exist thanks to a mix of generations: while the “senior” intern brings wisdom, experience and balance into the frenetic workplace of an Internet startup, the movie also celebrates the energy and creativity of the Millennials who are driving today’s tech economy.
",115,,,
Generation Flex,Health & Wellbeing,,Emerging Patterns,Trends,Case Study,THE INTERN,Link,http://www.huffingtonpost.com/simin-nikbin-meydani/5-lessons- deniros-intern-_b_8269390.html,116,,,
Generation Flex,Health & Wellbeing,,Emerging Patterns,Trends,Case Study,ENCORE.ORG,Subtitle,Second acts for the greater good,117,,,
Generation Flex,Health & Wellbeing,,Emerging Patterns,Trends,Case Study,ENCORE.ORG,Body Copy,"While many people might think that the contemporary aging society is merely a problem, many others also see it as a solution. Encore.org promotes work in the second half of life, based on the idea of leveraging the skills and talents of experienced adults to improve communities and the world. It combines social impact, purpose, and often, continued income. In other words Encore is a bridge, a channel, a platform for communication, “a movement to tap the skills and experience of those in midlife and beyond.”
In fact Encore does not work with individual job-seekers, nor do they list jobs. What they do is summarised in 3 points:
-        Use different communication techniques and the power of personal stories to “create a new narrative for later life” with the aim of challenging conventional thinking about aging;
-        Create and support pathways to connect people in later life with opportunities for work that benefits society.
-        Serve as a hub and resource for people who share the Encore vision. By embracing this culture it might be possible to improve later life, and also create a better future for generations to come.
",118,,,
Generation Flex,Health & Wellbeing,,Emerging Patterns,Trends,Case Study,ENCORE.ORG,Link,http://encore.org/,119,,,
Generation Flex,Health & Wellbeing,,Emerging Patterns,Trends,Case Study,PALETTE,Subtitle,Transgenerational art engagement programme,120,,,
Generation Flex,Health & Wellbeing,,Emerging Patterns,Trends,Case Study,PALETTE,Body Copy,"Promoting Art for Life Enrichment Through Transgenerational Engagement (PALETTE) was founded in 2013 and its first programs were launched in 2014. PALETTE connects junior health professionals and active older adults through creative arts activities. In the United States, ageism is a challenging issue, that affects care delivery and long- term health outcomes for older adults. Palette was created in order to challenge those negative attitudes, providing a transgenerational arts programming to foster friendships that can break down generational stereotypes.
A successful intergenerational program is a collaborative experience, with both younger and older generations contributing to the exchange in a meaningful and deliberate manner. Such intergenerational programs can challenge stereotypes and foster new understanding between generations. By structuring its programming around the collaborative creation of art, PALETTE provides a forum for younger and older adults to build relationships in a meaningful and purposeful way.
",121,,,
Generation Flex,Health & Wellbeing,,Emerging Patterns,Trends,Case Study,PALETTE,Link,https://paletteprogram.org/,122,,,
Generation Flex,Health & Wellbeing,,Emerging Patterns,Trends,Case Study,MOUNT’S ILC,Subtitle,Children of all the ages,123,,,
Generation Flex,Health & Wellbeing,,Emerging Patterns,Trends,Case Study,MOUNT’S ILC,Body Copy,"Our society is getting older and many elderly caring associations are starting to understand that combining different generational needs could be a way to increase social interaction in the community.
The Mount’s Intergenerational Learning Center (ILC) is a community of individuals composed of children, adults in need of short-term rehabilitation care and older members of the community who need a home.
Thanks to the interaction and the connections among these generations, the intergenerational learning center offers educational programs for the youngest as well as caring assistance for the oldest. During the workday, children and Mount’s residents come to the classroom, trying different activities such as music, art and storytelling: all these activities bring positive results and benefits for all generations. For the elderly people, having this degree of social interaction helps them in reducing loneliness and mental decline. The impact on children is not clear yet, but researchers suggest that kids who have early contact with older people are more respectful and less conditioned by the ageism phenomenon. For kids, having this kind social interaction is very important for the development of their own values.
",124,,,
Generation Flex,Health & Wellbeing,,Emerging Patterns,Trends,Case Study,MOUNT’S ILC,Link,http://washington.providence.org/senior-care/mount-st-vincent/services/child-care/,125,,,
Generation Flex,Health & Wellbeing,,Emerging Patterns,Trends,Case Study,NEXTGEN - iPROSPECT,Subtitle,Education for better communication,126,,,
Generation Flex,Health & Wellbeing,,Emerging Patterns,Trends,Case Study,NEXTGEN - iPROSPECT,Body Copy,"Even though the majority of the iProspect workforce is comprised of Millennials, they still focus on the interactions between young workers and managers, senior staff members and clients who are Gen Xers or Baby Boomers.
In fact it has been suggested that many young employees might find it difficult to engage to with older people when they are anxious.
This is only one of various possible challenges and potential conflicts that the digital firm wanted to minimise.
In collaboration with Google they created NEXTGEN “a global development programme for all of its employees to help them learn from their peers”. The program aims to train the next generation of digital talent, not only by giving people expertise in a wide range of digital tools but also by improving as much as possible their interpersonal skills, combining interactive live classes and collaborative virtual group projects.
",127,,,
Generation Flex,Health & Wellbeing,,Emerging Patterns,Trends,Case Study,NEXTGEN - iPROSPECT,Link,https://www.iprospect.com/en/gb/blog/next-gen-2016/,128,,,
Generation Flex,Health & Wellbeing,,Emerging Patterns,Trends,Case Study,REVERSE MENTORING - MICROSOFT,Subtitle,How millennials are becoming the new mentors,129,,,
Generation Flex,Health & Wellbeing,,Emerging Patterns,Trends,Case Study,REVERSE MENTORING - MICROSOFT,Body Copy,"In order to cope with both the growing generational gap and the need to stay on the cutting digital edge, more and more senior executives are turning to their younger colleagues for insights and guidance.
At Microsoft Norway, Michael Jacobs, General Manager, regularly meets with Magnus Svorstøl Lie, Partner Sales Executive hired through the Microsoft Academy of College Hires (MACH) program, for one-on-one sessions in flipped mode.
Michael gets coaching on topics ranging from new digital communication tools to workplace trends, while Magnus gets valuable insights into leadership and a glimpse at the larger picture.
It’s called reverse mentoring, initially launched at Microsoft Austria in 2014, has gradually spread over all European countries.
What drives younger talent? How to move forward? What the workplace should look like? These are just some of the questions that can be answered when digital natives coach senior leaders. It is also perceived as a personal challenge in order to learn something different by exploring new ideas and reflecting on leadership and the way it influences the workplace.
",130,,,
Generation Flex,Health & Wellbeing,,Emerging Patterns,Trends,Case Study,REVERSE MENTORING - MICROSOFT,Link,https://news.microsoft.com/europe/features/reverse-mentoring-how-millennials-are-becoming-the-new-mentors/,131,,,
Generation Flex,Health & Wellbeing,,Emerging Patterns,Trends,Case Study,GRUPO GALLEGOS,Subtitle,Overlap zones,132,,,
Generation Flex,Health & Wellbeing,,Emerging Patterns,Trends,Case Study,GRUPO GALLEGOS,Body Copy,"The offices of Grupo Gallegos at Huntington Beach, California, are designed by Lorcan O’Herlihy Architects and built into the shell of an old movie theater. It offers a great example of the overlapping zones trend.
LOHA worked to give employees a layout that would promote easy and meaningful collaboration. Part of that was achieved by knocking down walls and barriers to give ‘visual connectivity’. Moreover, common areas and crossing points are specifically designed in order to “help encourage spontaneous collaboration among employees”. The stairway, for instance, is a place where you can often find employees sitting down and having informal meetings.
Research from the University of Michigan shows that when scientists worked in a space where they ran into one another - in areas known as “zonal overlap"" - they were more likely to collaborate. The data suggests that creating opportunities for unplanned interactions among employees both inside and outside the organization actually improves performance.
",133,,,
Generation Flex,Health & Wellbeing,,Emerging Patterns,Trends,Case Study,GRUPO GALLEGOS,Link,https://blog.hubspot.com/marketing/innovative-companies-changing-workplace,134,,,
Generation Flex,Health & Wellbeing,,Emerging Patterns,Trends,Case Study,AGING FRIENDLY OFFICE LIGHTING,Subtitle,Discover more on human centric lighting,135,,,
Generation Flex,Health & Wellbeing,,Emerging Patterns,Trends,Case Study,AGING FRIENDLY OFFICE LIGHTING,Body Copy,"With more than 120 years at the forefront of innovation, Philips has offered to the market many innovative lighting solutions. Taking account of the needs of different generations is an important way to make people more comfortable and productive, providing high- quality light in public places and professional spaces. At a time when we are all living and working longer many questions are arising, such as:
What are the things an older employee struggles with the most in relation to lighting?
How can you design office lighting and accommodate different worker age groups?
How can lighting support concentration or creative tasks?
“The one-light-for-all principle is outdated [...] Today 25% of people in work are over 50 years old and office lighting needs a serious rethink at a policy level.”
Flexibility and personalization are considered to be two very important characteristics that can distinguish new solutions suitable for an ageing workforce but also compelling and appetible for younger workers.
",136,,,
Generation Flex,Health & Wellbeing,,Emerging Patterns,Trends,Case Study,AGING FRIENDLY OFFICE LIGHTING,Link,http://www.lighting.philips.com/main/education/lighting-university/aging-friendly-office-lighting,137,,,
Generation Flex,Health & Wellbeing,,Case Study,,,MEDIBANK PLACE,Section Description,"Medibank is Australia's largest health insurance company and its policy is to have the best health outcomes for its members, employees and for the community.",138,,,
Generation Flex,Health & Wellbeing,,Case Study,,,MEDIBANK PLACE,Body Copy,,139,,,
Generation Flex,Health & Wellbeing,,Solutions,,,,Subtitle,SOLUTIONS FOR SMART WORKING,140,,,
Generation Flex,Health & Wellbeing,,Solutions,,,,Section Description,How can office furniture solutions offer the chance to adapt space quickly and effectively in response to the continually changing needs of individuals and teams?,141,,,
Generation Flex,Health & Wellbeing,,Solutions,,,,Body Copy,"The environment and interior design of an office landscape can substantially contribute to bringing different generations together. The way we design space should provide suitable solutions for people according to their mood, activity and physical needs.

As the average age of office workers is increasing, and as even younger people risk becoming sedentary in the way they work, the demand for furniture which supports and encourages more movement and activity is growing.

New work settings should stimulate spontaneous interaction on the one hand and provide the opportunity to sit back and relax or even offer areas where people can work in a focused way without being interrupted.",142,,,